{"v":2,"event_id":"AAECAwQFBgcICQoLDA0ODw","incident_id":"AAECAwQFBgcICQoLDA0ODw","device_id":"EBESExQVFhcYGRobHB0eHw","kind":"live.triggered","sequence":0,"created_at":1788105600,"expires_at":1788109200,"payload":{"key_version":1,"iv":"YGFiY2RlZmdoaWprbG1ubw","ciphertext":"8eRa_JOzxdPOO3l494xv5Q","tag":"Od2xdL8I6MFPc2V44iVzICC1eChn4NcItWb9GWpA4N4"}}
