{"v":2,"event_id":"sLGys7S1tre4ubq7vL2-vw","incident_id":"AAECAwQFBgcICQoLDA0ODw","device_id":"EBESExQVFhcYGRobHB0eHw","kind":"location.updated","sequence":1,"created_at":1788105660,"expires_at":1788109200,"payload":{"key_version":1,"iv":"wMHCw8TFxsfIycrLzM3Ozw","ciphertext":"Ni1HgpKbRi0gcHT2Ms7Xkw","tag":"S8R_5VcmENMUis6bks2I5krpdi3wws7Txmcq9nv9G1M"}}
